{
  "schema_version": "7.0",
  "run_id": "0b902811-51a1-42b2-8059-af1661d6cade",
  "agent_name": "example",
  "status": "succeeded",
  "confidence": 0.5,
  "reasoning_summary": "example",
  "warnings": [
    "example"
  ],
  "requires_human_review": true,
  "completed_at": "2026-07-31T12:00:00Z",
  "resource_draft_id": "ad2e5099-ba46-46b2-937e-6a5cefb7a575",
  "resource_title": "example",
  "resource_type": "learning_package",
  "difficulty_level": 1,
  "personalization_reason": "example",
  "sections": [
    {
      "section_type": "explanation",
      "title": "example",
      "content": {},
      "evidence_ids": [
        "9b958716-3b84-4c4c-9c4f-354f5e2f70aa"
      ]
    }
  ],
  "coverage_knowledge_node_ids": [
    "example"
  ],
  "all_evidence_ids": [
    "a6d918d0-2753-44fe-a0bd-8ecfed3e2884"
  ],
  "parallel_branch_run_ids": [
    "e7de9adc-96a6-467c-841a-c3b1c56a1e11"
  ],
  "revision_no": 1
}
